,isin,nome,ticker,benchmark,ter,areaBenchmark,emittente,strumento,dataSource
0,DE0002635265,ISHARES PFANDBRIEFE UCITS ETF,EXHE.MI,MARKIT IBOXX PFANDBRIEFE,0.00096,OBBLIGAZIONARIO CORPORATE - EURO,ISHARES,ETF,EXHE.MI
1,DE0002635299,ISHARES STX EUROPE SEL DIV 30 UCITS ETF,EXSH.MI,STOXX EUROPE SELECT DIVIDEND 30,0.0032,AZIONARIO STYLE (SVILUPPATI),ISHARES,ETF,EXSH.MI
2,DE0002635307,ISHARES STOXX EUROPE 600 UCITS ETF,EXSA.MI,STOXX EUROPE 600,0.00203,AZIONARIO EUROPA - AREA,ISHARES,ETF,EXSA.MI
3,DE0005933931,ISHARES CORE DAX UCITS ETF,EXS1.MI,DAX,0.00171,AZIONARIO EUROPA - SINGOLI PAESI,ISHARES,ETF,EXS1.MI
4,DE000A0D8Q07,ISHARES EURO STOXX UCITS ETF,EXSI.MI,EURO STOXX,0.00207,AZIONARIO EUROPA - AREA,ISHARES,ETF,EXSI.MI
5,DE000A0D8Q49,ISHARES DJ US SELECT DIVIDEND UCITS ETF,EXX5.MI,DOW JONES US SELECT DIVIDEND,0.0032,AZIONARIO STYLE (SVILUPPATI),ISHARES,ETF,EXX5.MI
6,DE000A0H0728,ISHARES DIVERS COMMODITY SWAP UCITS ETF,EXXY.MI,BLOOMBERG COMMODITY INDEX,0.0047,COMMODITIES,ISHARES,ETF,EXXY.MI
7,DE000A0Q4RZ9,ISHARES EB.REXX MONEY MARKET UCITS ETF,EXVM.MI,EB.REXX MONEY MARKET TR,0.00126,TITOLI DI STATO - EURO,ISHARES,ETF,EXVM.MI
8,FR0007054358,LYXOR EURO STOXX 50 DR UCITS ETF - DIST,MSE.MI,EURO STOXX 50 TRN,0.002,AZIONARIO EUROPA - AREA,LYXOR,ETF,MSE.MI
9,FR0007056841,LYXOR DJ INDUST AVERAGE UCITS ETF - DIST,DJE.MI,DOW JONES INDUSTRIAL AVG TRN,0.005,AZIONARIO NORD AMERICA,LYXOR,ETF,DJE.MI
10,FR0007063177,LYXOR NASDAQ-100 UCITS ETF - DIST,UST.MI,NASDAQ 100 TRN,0.003,AZIONARIO NORD AMERICA,LYXOR,ETF,UST.MI
11,FR0007075494,LYXOR UCITS ETF DJ GLOBAL TITANS 50,MGT.MI,DJ GLOBAL TITANS 50 NTR,0.004,AZIONARIO MONDO,LYXOR,ETF,MGT.MI
12,FR0010010827,LYXOR FTSE MIB UCITS ETF - DIST,ETFMIB.MI,FTSE MIB TRN,0.0035,AZIONARIO ITALIA,LYXOR,ETF,ETFMIB.MI
13,FR0010204073,LYXOR EASTERN EUROPE UCITS ETF - ACC,EST.MI,CECE COMPOSITE INDEX NTR,0.005,AZIONARIO EMERGENTI - EST EUROPA,LYXOR,ETF,EST.MI
14,FR0010204081,LYXOR CHINA ENTERPR HSCEI UCITS ETF ACC,CINA.MI,HANG SENG CHINA ENTERPRISES NTR,0.0065,AZIONARIO EMERGENTI - ASIA,LYXOR,ETF,CINA.MI
15,FR0010245514,LYXOR JAPAN TOPIX DR UCITS ETF - DIST,JPN.MI,TOPIX GROSS TR,0.0045,AZIONARIO PACIFICO,LYXOR,ETF,JPN.MI
16,FR0010261198,LYXOR MSCI EUROPE UCITS ETF - DIST,MEU.MI,MSCI TRN EUROPE INDEX,0.0025,AZIONARIO EUROPA - AREA,LYXOR,ETF,MEU.MI
17,FR0010270033,LYXOR COMMODITIES CRB TR UCITS ETF ACC,CRB.MI,THOMSON REUTERS/JEFFERIES CRB TOTAL RETURN,0.0035,COMMODITIES,LYXOR,ETF,CRB.MI
18,FR0010296061,LYXOR MSCI USA UCITS ETF - DIST,LUSA.MI,MSCI TRN USA INDEX,0.0025,AZIONARIO NORD AMERICA,LYXOR,ETF,LUSA.MI
19,FR0010312124,LYXOR MSCI ACASIA PAC EXJP UCITS ETF ACC,AEJ.MI,MSCI AC ASIA EX JAPAN TRN INDEX,0.006,AZIONARIO EMERGENTI - ASIA,LYXOR,ETF,AEJ.MI
20,FR0010315770,LYXOR MSCI WORLD UCITS ETF - DIST,WLD.MI,MSCI TRN WORLD INDEX,0.003,AZIONARIO MONDO,LYXOR,ETF,WLD.MI
21,FR0010326140,LYXOR RUSSIA (DJ RUSS GDR) UCITS ETF ACC,RUS.MI,DJ RUSSIA GDR PRICE,0.0065,AZIONARIO EMERGENTI - EST EUROPA,LYXOR,ETF,RUS.MI
22,FR0010326256,LYXOR TURKEY UCITS ETF - ACC,TUR.MI,DOW JONES TURKEY TITANS 20 TR,0.0065,AZIONARIO EMERGENTI - EST EUROPA,LYXOR,ETF,TUR.MI
23,FR0010344630,LYXOR STX EU600 AUTO&PART UCITS ETF ACC,AUTP.MI,STOXX EUROPE 600 AUTOMOBILES & PARTS TRN,0.003,AZIONARIO SETTORIALI (SVILUPPATI),LYXOR,ETF,AUTP.MI
24,FR0010344796,LYXOR STX EU600 TECHNOLOGY UCITS ETF ACC,TNO.MI,STOXX EUROPE 600 TECHNOLOGY TRN,0.003,AZIONARIO SETTORIALI (SVILUPPATI),LYXOR,ETF,TNO.MI
25,FR0010344812,LYXOR STX EU600 TELECOM UCITS ETF ACC,TELE.MI,STOXX EUROPE 600 TELECOMMUNICATIONS TRN,0.003,AZIONARIO SETTORIALI (SVILUPPATI),LYXOR,ETF,TELE.MI
26,FR0010344838,LYXOR STX EU600 TRAV&LEIS UCITS ETF ACC,TRVL.MI,STOXX EUROPE 600 TRAVEL & LEISURE TRN,0.003,AZIONARIO SETTORIALI (SVILUPPATI),LYXOR,ETF,TRVL.MI
27,FR0010344853,LYXOR STX EU600 UTILITIES UCITS ETF ACC,UTI.MI,STOXX EUROPE 600 UTILITIES TRN,0.003,AZIONARIO SETTORIALI (SVILUPPATI),LYXOR,ETF,UTI.MI
28,FR0010344861,LYXOR STX EU 600 FOOD&BEV UCITS ETF ACC,FOO.MI,STOXX EUROPE 600 FOOD & BEVERAGE TRN,0.003,AZIONARIO SETTORIALI (SVILUPPATI),LYXOR,ETF,FOO.MI
29,FR0010344879,LYXOR STX EU 600 HEALTHCAR UCITS ETF ACC,HLT.MI,STOXX EUROPE 600 HEALTH CARE TRN,0.003,AZIONARIO SETTORIALI (SVILUPPATI),LYXOR,ETF,HLT.MI
30,FR0010344887,LYXOR STX EU600 IN GOO&SER UCITS ETF ACC,INDG.MI,STOXX EUROPE 600 INDUSTRIAL GOODS & SERVICES TRN,0.003,AZIONARIO SETTORIALI (SVILUPPATI),LYXOR,ETF,INDG.MI
31,FR0010344903,LYXOR STX EU600 INSURANCE UCITS ETF ACC,INS.MI,STOXX EUROPE 600 INSURANCE TRN,0.003,AZIONARIO SETTORIALI (SVILUPPATI),LYXOR,ETF,INS.MI
32,FR0010344929,LYXOR STX EU600 MEDIA UCITS ETF - ACC,MDA.MI,STOXX EUROPE 600 MEDIA TRN,0.003,AZIONARIO SETTORIALI (SVILUPPATI),LYXOR,ETF,MDA.MI
33,FR0010344960,LYXOR STX EU600 OIL&GAS UCITS ETF ACC,OIL.MI,STOXX EUROPE 600 OIL & GAS TRN,0.003,AZIONARIO SETTORIALI (SVILUPPATI),LYXOR,ETF,OIL.MI
34,FR0010344978,LYXOR STX EU600 PERS&HOUSE UCITS ETF ACC,PHG.MI,STOXX EUROPE 600 PERSONAL & HOUSEHOLD GOODS TRN,0.003,AZIONARIO SETTORIALI (SVILUPPATI),LYXOR,ETF,PHG.MI
35,FR0010344986,LYXOR STX EU600 RETAIL UCITS ETF ACC,RTA.MI,STOXX EUROPE 600 RETAIL TRN,0.003,AZIONARIO SETTORIALI (SVILUPPATI),LYXOR,ETF,RTA.MI
36,FR0010345363,LYXOR STX EU600 FINAN SERV UCITS ETF ACC,FINS.MI,STOXX EUROPE 600 FINANCIAL SERVICES TRN,0.003,AZIONARIO SETTORIALI (SVILUPPATI),LYXOR,ETF,FINS.MI
37,FR0010345371,LYXOR STX EU 600 BANKS UCITS ETF ACC,BNK.MI,STOXX EUROPE 600 BANKS TRN,0.003,AZIONARIO SETTORIALI (SVILUPPATI),LYXOR,ETF,BNK.MI
38,FR0010345389,LYXOR STX EU600 BASIC RES UCITS ETF ACC,BRES.MI,STOXX EUROPE 600 BASIC RESOURCES TRN,0.003,AZIONARIO SETTORIALI (SVILUPPATI),LYXOR,ETF,BRES.MI
39,FR0010345470,LYXOR STX EU 600 CHEMICALS UCITS ETF ACC,CHM.MI,STOXX EUROPE 600 CHEMICALS TRN,0.003,AZIONARIO SETTORIALI (SVILUPPATI),LYXOR,ETF,CHM.MI
40,FR0010345504,LYXOR STX EU600 CONST&MAT UCITS ETF ACC,CST.MI,STOXX EUROPE 600 CONSTRUCTION & MATERIALS TRN,0.003,AZIONARIO SETTORIALI (SVILUPPATI),LYXOR,ETF,CST.MI
41,FR0010346205,LYXOR COMMOD CRB EX-ENERGY UCITS ETF ACC,CRBN.MI,THOMSON REUTERS/JEFFERIES CRB EX-ENERGY TR,0.0035,COMMODITIES,LYXOR,ETF,CRBN.MI
42,FR0010361675,LYXOR HONG KONG (HSI) UCITS ETF - DIST,HK.MI,HANG SENG NTR,0.0065,AZIONARIO EMERGENTI - ASIA,LYXOR,ETF,HK.MI
43,FR0010361683,LYXOR MSCI INDIA UCITS ETF - ACC,INDI.MI,MSCI INDIA TRN,0.0085,AZIONARIO EMERGENTI - ASIA,LYXOR,ETF,INDI.MI
44,FR0010361691,LYXOR MSCI KOERA UCITS ETF - C-EUR,KOR.MI,MSCI KOREA INDEX,0.0065,AZIONARIO EMERGENTI - ASIA,LYXOR,ETF,KOR.MI
45,FR0010397554,LYXOR MSCI MALAYSIA UCITS ETF - ACC,MAL.MI,MSCI MALAYSIA TRN,0.0065,AZIONARIO EMERGENTI - ASIA,LYXOR,ETF,MAL.MI
46,FR0010405431,LYXOR FTSE ATHEX LARGCAP UCITS ETF - DIS,GRC.MI,FTSE/ATHEX LARGE CAP NTR,0.0045,AZIONARIO EUROPA - SINGOLI PAESI,LYXOR,ETF,GRC.MI
47,FR0010408799,LYXOR BRAZIL (IBOVESPA) UCITS ETF - ACC,BRA.MI,BOVESPA INDEX,0.0065,AZIONARIO EMERGENTI - CENTRO/SUD AMERICA,LYXOR,ETF,BRA.MI
48,FR0010410266,LYXOR MSCI EM LAT AMERICA UCITS ETF ACC,LATAM.MI,MSCI EM LATIN AMERICA USD NET RETURN,0.0065,AZIONARIO EMERGENTI - CENTRO/SUD AMERICA,LYXOR,ETF,LATAM.MI
49,FR0010429068,LYXOR MSCI EMERGING MKTS UCITS ETF ACC,EMKT.MI,MSCI EMERGING MARKETS TRN INDEX,0.0055,AZIONARIO EMERGENTI - MONDO,LYXOR,ETF,EMKT.MI
50,FR0010444786,LYXOR MSCI TAIWAN UCITS ETF - ACC,TWN.MI,MSCI TAIWAN TRN INDEX,0.0065,AZIONARIO EMERGENTI - ASIA,LYXOR,ETF,TWN.MI
51,FR0010464446,LYXOR SAFR FTSE JSE TOP40 UCITS ETF ACC,SAFRI.MI,FTSE JSE TOP 40 NET TRI,0.0065,AZIONARIO EMERGENTI - AFRICA/MEDIO ORIENTE,LYXOR,ETF,SAFRI.MI
52,FR0010510800,LYXOR EURO CASH UCITS ETF - ACC,LEONIA.MI,FTSE MTS EONIA INVESTABLE,0.001,LIQUIDITA',LYXOR,ETF,LEONIA.MI
53,FR0010524777,LYXOR NEW ENERGY UCITS ETF - DIST,ENER.MI,WORLD ALTERNATIVE ENERGY INDEX CAP WEIGHTED NTR,0.006,AZIONARIO TEMATICI,LYXOR,ETF,ENER.MI
54,FR0010527275,LYXOR WORLD WATER UCITS ETF - DIST,WAT.MI,WORLD WATER INDEX CAP WEIGHTED NTR,0.006,AZIONARIO TEMATICI,LYXOR,ETF,WAT.MI
55,FR0010652867,LYXOR MSCI AC ASIA EX JPN UCITS ETF ACC,APEX.MI,MSCI AC ASIA EX JAPAN TRN INDEX,0.005,AZIONARIO EMERGENTI - ASIA,LYXOR,ETF,APEX.MI
56,IE0005042456,ISHARES CORE FTSE 100 UCITS ETF DIST,ISF.MI,FTSE 100,0.0007,AZIONARIO EUROPA - SINGOLI PAESI,ISHARES,ETF,ISF.MI
57,IE0008470928,ISHARES STOXX EUROPE 50 UCITS ETF DIST,EUN.MI,STOXX EUROPE 50,0.0035,AZIONARIO EUROPA - AREA,ISHARES,ETF,EUN.MI
58,IE0008471009,ISHARESCOREEUROSTOXX50€(DIST) UCITS ETF,EUE.MI,EURO STOXX 50,0.001,AZIONARIO EUROPA - AREA,ISHARES,ETF,EUE.MI
59,IE0031442068,ISHARESCORES&P500$(DIST) UCITS ETF,IUSA.MI,S&P 500,0.0007,AZIONARIO NORD AMERICA,ISHARES,ETF,IUSA.MI
60,IE0032077012,INVESCO EQQQ NASDAQ-100 UCITS ETF,EQQQ.MI,NASDAQ 100,0.002,AZIONARIO NORD AMERICA,INVESCO,ETF,EQQQ.MI
61,IE0032523478,ISHARES CORP BOND LAR CAP UCITS ETF DIST,IBCX.MI,MARKIT IBOXX EURO LIQUID CORPORATE LARGE CAP TR,0.002,OBBLIGAZIONARIO CORPORATE - EURO,ISHARES,ETF,IBCX.MI
62,IE0032895942,ISHARES $ CORP BOND UCITS ETF USD DIST,LQDE.MI,MARKIT IBOXX USD LIQUID INVESTMENT GRADE TR,0.002,OBBLIGAZIONARIO CORPORATE - NON EURO,ISHARES,ETF,LQDE.MI
63,IE00B02KXH56,ISHARES MSCI JAPAN UCITS ETF USD DIST,IJPN.MI,MSCI JAPAN,0.0059,AZIONARIO PACIFICO,ISHARES,ETF,IJPN.MI
64,IE00B02KXK85,ISHARES CHINA LARGE CAP UCITS ETF DIST,FXC.MI,FTSE CHINA 50,0.0074,AZIONARIO EMERGENTI - ASIA,ISHARES,ETF,FXC.MI
65,IE00B02KXL92,ISHARES EURO STOXX MID UCITS ETF DIST,DJMC.MI,EURO STOXX MID,0.004,AZIONARIO STYLE (SVILUPPATI),ISHARES,ETF,DJMC.MI
66,IE00B02KXM00,ISHARES EURO STOXX SMALL UCITS ETF DIST,DJSC.MI,EURO STOXX SMALL,0.004,AZIONARIO STYLE (SVILUPPATI),ISHARES,ETF,DJSC.MI
67,IE00B0M62Q58,ISHARES MSCI WORLD UCITS ETF USD DIST,IWRD.MI,MSCI WORLD INDEX,0.005,AZIONARIO MONDO,ISHARES,ETF,IWRD.MI
68,IE00B0M62S72,ISHARES EURO DIVIDEND UCITS ETF EUR DIST,IDVY.MI,EURO STOXX SELECT DIVIDEND 30 INDEX,0.004,AZIONARIO STYLE (SVILUPPATI),ISHARES,ETF,IDVY.MI
69,IE00B0M62X26,ISHARES INFL LINKED GOVT UCITS ETF ACC,IBCI.MI,BLOOMBERG BARCLAYS EURO GOV INFLATION-LINKED BOND,0.0025,INFLAZIONE,ISHARES,ETF,IBCI.MI
70,IE00B0M63060,ISHARES UK DIVIDEND UCITS ETF DIST,IUKD.MI,FTSE UK DIVIDEND PLUS INDEX,0.004,AZIONARIO STYLE (SVILUPPATI),ISHARES,ETF,IUKD.MI
71,IE00B0M63177,ISHARES MSCI EM UCITS ETF DIST,IEEM.MI,MSCI EMERGING MARKETS INDEX,0.0075,AZIONARIO EMERGENTI - MONDO,ISHARES,ETF,IEEM.MI
72,IE00B0M63284,ISHARES EURO PROP YIELD UCITS ETF DIST,IPRP.MI,FTSE EPRA/NAREIT DEV EUROPE EX UK DIV + INDEX TR,0.004,REAL ESTATE,ISHARES,ETF,IPRP.MI
73,IE00B0M63391,ISHARES MSCI KOREA UCITS ETF USD DIST,IKOR.MI,MSCI KOREA INDEX,0.0074,AZIONARIO EMERGENTI - ASIA,ISHARES,ETF,IKOR.MI
74,IE00B0M63516,ISHARES MSCI BRAZIL UCITS ETF DIST,IBZL.MI,MSCI BRAZIL INDEX,0.0074,AZIONARIO EMERGENTI - CENTRO/SUD AMERICA,ISHARES,ETF,IBZL.MI
75,IE00B0M63623,ISHARES MSCI TAIWAN UCITS ETF USD DIST,ITWN.MI,MSCI TAIWAN,0.0074,AZIONARIO EMERGENTI - ASIA,ISHARES,ETF,ITWN.MI
76,IE00B0M63730,ISHARES MSCI AC FARE EX-J UCITS ETF DIST,IFFF.MI,MSCI AC FAR EAST EX-JAPAN INDEX,0.0074,AZIONARIO EMERGENTI - ASIA,ISHARES,ETF,IFFF.MI
77,IE00B14X4M10,ISHARES MSCI NORTH AMER UCITS ETF DIST,INAA.MI,MSCI NORTH AMERICA,0.004,AZIONARIO NORD AMERICA,ISHARES,ETF,INAA.MI
78,IE00B14X4N27,ISHARES MSCI EURO EX-UK UCITS ETF DIST,IEUX.MI,MSCI EUROPE EX-UK,0.004,AZIONARIO EUROPA - AREA,ISHARES,ETF,IEUX.MI
79,IE00B14X4Q57,ISHARES GOVT BOND 1-3YR UCITS ETF DIST,IBGS.MI,BARCLAYS EURO GOV BOND 1-3 YEAR TERM,0.002,TITOLI DI STATO - EURO,ISHARES,ETF,IBGS.MI
80,IE00B14X4S71,ISHARES $ TREASURY 1-3YR UCITS ETF DIST,IBTS.MI,BARCLAYS US TREASURY 1-3 YEAR TERM,0.002,TITOLI DI STATO - NON EURO,ISHARES,ETF,IBTS.MI
81,IE00B14X4T88,ISHARES ASIA PACIF DIVID UCITS ETF DIST,IAPD.MI,DOW JONES ASIA/PACIFIC SELECT DIVIDEND 30,0.0059,AZIONARIO STYLE (SVILUPPATI),ISHARES,ETF,IAPD.MI
82,IE00B1FZS244,ISHARES ASIA PROPERTY YLD UCITS ETF DIST,IASP.MI,FTSE EPRA/NAREIT DEV ASIA DIVIDEND + INDEX TR,0.0059,REAL ESTATE,ISHARES,ETF,IASP.MI
83,IE00B1FZS350,ISHARES DEV MKT PROP YLD UCITS ETF DIST,IWDP.MI,FTSE EPRA/NAREIT DEVELOPED DIVIDEND + INDEX TR,0.0059,REAL ESTATE,ISHARES,ETF,IWDP.MI
84,IE00B1FZS467,ISHARES GLOBAL INFRASTR UCITS ETF DIST,INFR.MI,FTSE GLOBAL CORE INFRASTRUCTURE,0.0065,AZIONARIO TEMATICI,ISHARES,ETF,INFR.MI
85,IE00B1FZS574,ISHARES MSCI TURKEY UCITS ETF USD DIST,ITKY.MI,MSCI TURKEY SM INDEX,0.0074,AZIONARIO EMERGENTI - EST EUROPA,ISHARES,ETF,ITKY.MI
86,IE00B1FZS681,ISHARES EURO GOVT BOND 3-5YR UCITS ETF,IBGX.MI,BARCLAYS EURO GOV BOND 5 YEAR TERM,0.002,TITOLI DI STATO - EURO,ISHARES,ETF,IBGX.MI
87,IE00B1FZS798,ISHARES $ TREASURY 7-10YR UCITS ETF DIST,IBTM.MI,BARCLAYS US TREASURY 10 YEAR TERM,0.002,TITOLI DI STATO - NON EURO,ISHARES,ETF,IBTM.MI
88,IE00B1FZS806,ISHARES EU GOVT 7-10YR UCITS ETF DIST,IBGM.MI,BARCLAYS EURO GOV BOND 10 YEAR TERM,0.002,TITOLI DI STATO - EURO,ISHARES,ETF,IBGM.MI
89,IE00B1FZS913,ISHARES EU GOVT 15-30YR UCITS ETF DIST,IBGL.MI,BARCLAYS EURO GOV BOND 30 YEAR TERM,0.002,TITOLI DI STATO - EURO,ISHARES,ETF,IBGL.MI
90,IE00B1FZSB30,ISHARES CORE UK GILTS UCITS ETF GBP DIST,IGLT.MI,FTSE ACTUARIES GOV SECURITIES UK GILTS ALL STOCK,0.002,TITOLI DI STATO - NON EURO,ISHARES,ETF,IGLT.MI
91,IE00B1FZSC47,ISHARES $ TIPS UCITS ETF USD ACC,ITPS.MI,BARCLAYS U.S. GOV INFLATION-LINKED ALL BONDS,0.0025,INFLAZIONE,ISHARES,ETF,ITPS.MI
92,IE00B1FZSF77,ISHARES US PROPERTY YIELD UCITS ETF,IUSP.MI,FTSE EPRA/NAREIT UNITED STATES DIVIDEND + INDEX TR,0.004,REAL ESTATE,ISHARES,ETF,IUSP.MI
93,IE00B1TXK627,ISHARES GLOBAL WATER UCITS ETF USD DIST,IH2O.MI,S&P GLOBAL WATER INDEX,0.0065,AZIONARIO TEMATICI,ISHARES,ETF,IH2O.MI
94,IE00B1TXLS18,ISHARES UK PROPERTY UCITS ETF GBP DIST,IUKP.MI,FTSE EPRA/NAREIT UK INDEX TR,0.004,REAL ESTATE,ISHARES,ETF,IUKP.MI
95,IE00B1W57M07,ISHARES BRIC 50 UCITS ETF USD DIST,BR50.MI,FTSE BRIC 50 INDEX,0.0074,AZIONARIO EMERGENTI - MONDO,ISHARES,ETF,BR50.MI
96,IE00B1XNH568,ISHARES FTSE MIB UCITS ETF EUR DIST,IMIB.MI,FTSE MIB,0.0035,AZIONARIO ITALIA,ISHARES,ETF,IMIB.MI
97,IE00B1XNHC34,ISHARES GLOBAL CLEAN ENERGY UCITS ETF,INRG.MI,S&P GLOBAL CLEAN ENERGY,0.0065,AZIONARIO TEMATICI,ISHARES,ETF,INRG.MI
98,IE00B1YZSC51,ISHARESCOREMSCIEUROPE UCITS ETF,IMEU.MI,MSCI EUROPE,0.0012,AZIONARIO EUROPA - AREA,ISHARES,ETF,IMEU.MI
99,IE00B23D8S39,INVESCO FTSE RAFI US 1000 UCITS ETF,PFT.MI,FTSE RAFI US 1000,0.0039,AZIONARIO NORD AMERICA,INVESCO,ETF,PFT.MI
100,IE00B23D8X81,INVESCO FTSE RAFI EUROPE UCITS ETF,PEF.MI,FTSE RAFI EUROPE,0.005,AZIONARIO EUROPA - AREA,INVESCO,ETF,PEF.MI
101,IE00B23D8Y98,INVESCO FTSE RAFI EU MID-SMALL UCITS ETF,PWD.MI,FTSE RAFI DEVELOPED EUROPE MID-SMALL,0.005,AZIONARIO EUROPA - AREA,INVESCO,ETF,PWD.MI
102,IE00B23D9240,INVESCO DYNAMIC US MARKET UCITS ETF,PWC.MI,DYNAMIC MARKET INTELLIDEX,0.0075,AZIONARIO NORD AMERICA,INVESCO,ETF,PWC.MI
103,IE00B23D9570,INVESCO FTSE RAFI EM MKTS UCITS ETF,PEH.MI,FTSE RAFI EMERGING MARKETS,0.0065,AZIONARIO EMERGENTI - MONDO,INVESCO,ETF,PEH.MI
104,IE00B27YCK28,ISHARES MSCI EM LAT AMER UCITS ETF DIST,LTAM.MI,MSCI EM LATIN AMERICA USD 10/40,0.0074,AZIONARIO EMERGENTI - CENTRO/SUD AMERICA,ISHARES,ETF,LTAM.MI
105,IE00B3B8Q275,ISHARES EU COVERED BOND UCITS ETF DIST,ICOV.MI,MARKIT IBOXX EURO COVERED INDEX TR,0.002,OBBLIGAZIONARIO CORPORATE - EURO,ISHARES,ETF,ICOV.MI
106,IE00B3BPCH51,INVESCO EUROMTS CASH 3 MONTHS UCITS ETF,PEU.MI,FTSE MTS EUROZONE GOVERNMENT BILL 0-6 MONTH CAPPED,0.0015,LIQUIDITA',INVESCO,ETF,PEU.MI
107,IE00B3CNHG25,L&G GOLD MINING UCITS ETF,AUCO.MI,DAXGLOBAL GOLD MINERS (TR) USD,0.0065,AZIONARIO TEMATICI,LEGAL & GENERAL,ETF,AUCO.MI
108,IE00B3CNHJ55,L&G RUSSELL 2000 US SMALL CAP UCITS ETF,RTWO.MI,RUSSELL 2000 TRN INDEX,0.0045,AZIONARIO NORD AMERICA,LEGAL & GENERAL,ETF,RTWO.MI
109,LU0252633754,LYXOR DAX (DR) UCITS ETF - ACC,DAXX.MI,DAX,0.0015,AZIONARIO EUROPA - SINGOLI PAESI,LYXOR,ETF,DAXX.MI
110,LU0274208692,XTRACKERS MSCI WORLD SWAP UCITS ETF,XMWO.MI,MSCI TRN WORLD INDEX,0.0045,AZIONARIO MONDO,XTRACKERS,ETF,XMWO.MI
111,LU0274209237,XTRACKERS MSCI EUROPE UCITS ETF,XMEU.MI,MSCI TRN EUROPE INDEX,0.003,AZIONARIO EUROPA - AREA,XTRACKERS,ETF,XMEU.MI
112,LU0274209740,XTRACKERS MSCI JAPAN UCITS ETF 1C,XMJP.MI,MSCI TRN JAPAN INDEX,0.005,AZIONARIO PACIFICO,XTRACKERS,ETF,XMJP.MI
113,LU0274210672,XTRACKERS MSCI USA SWAP UCITS ETF,XMUS.MI,MSCI TRN USA INDEX,0.003,AZIONARIO NORD AMERICA,XTRACKERS,ETF,XMUS.MI
114,LU0274211217,XTRACKERS EURO STOXX 50 UCITS ETF 1D,XESX.MI,EURO STOXX 50,0.0009,AZIONARIO EUROPA - AREA,XTRACKERS,ETF,XESX.MI
115,LU0274212538,XTRACKERS FTSE MIB UCITS ETF,XMIB.MI,FTSE MIB,0.003,AZIONARIO ITALIA,XTRACKERS,ETF,XMIB.MI
116,LU0274221281,XTRACKERS SWITZERLAND UCITS ETF,XSMI.MI,SMI,0.003,AZIONARIO EUROPA - SINGOLI PAESI,XTRACKERS,ETF,XSMI.MI
117,LU0290355717,XTRACKERS II EUROZ GOVT UCITS ETF 1C,XGLE.MI,IBOXX SOVEREIGNS EUROZONE TR,0.0015,TITOLI DI STATO - EURO,XTRACKERS,ETF,XGLE.MI
118,LU0290356871,XTRACKERS II EUROZ GOVT 1-3 UCITS ETF,X13E.MI,MARKIT IBOXX EUR EUROZONE (DE ES FR IT NL) 1-3 TR,0.0015,TITOLI DI STATO - EURO,XTRACKERS,ETF,X13E.MI
119,LU0290356954,XTRACKERS II EUROZ GOVT 3-5 UCITS ETF,X35E.MI,MARKIT IBOXX EUR EUROZONE (DE ES FR IT NL) 3-5 TR,0.0015,TITOLI DI STATO - EURO,XTRACKERS,ETF,X35E.MI
120,LU0290357176,XTRACKERS II EUROZ GOVT 5-7 UCITS ETF,X57E.MI,MARKIT IBOXX EUR EUROZONE (DE ES FR IT NL) 5-7 TR,0.0015,TITOLI DI STATO - EURO,XTRACKERS,ETF,X57E.MI
121,LU0290357259,XTRACKERS II EUROZ GOVT 7-10 UCITS ETF,X710.MI,MARKIT IBOXX EUR EUROZONE (DE ES FR IT NL) 7-10 TR,0.0015,TITOLI DI STATO - EURO,XTRACKERS,ETF,X710.MI
122,LU0290357333,XTRACKERS II EUROZ GOVT 10-15 UCITS ETF,X105.MI,MARKIT IBOXX EUR EUROZONE (DE ES FR IT NL) 10-15TR,0.0015,TITOLI DI STATO - EURO,XTRACKERS,ETF,X105.MI
123,LU0290357507,XTRACKERS II EUROZ GOVT 15-30 UCITS ETF,X15E.MI,MARKIT IBOXX EUR EUROZONE (DE ES FR IT NL) 15-30TR,0.0015,TITOLI DI STATO - EURO,XTRACKERS,ETF,X15E.MI
124,LU0290357846,XTRACKERS II EUROZ GOVT 25+ UCITS ETF,X25E.MI,MARKIT IBOXX EUR EUROZONE (DE ES FR IT NL) 25+ TR,0.0015,TITOLI DI STATO - EURO,XTRACKERS,ETF,X25E.MI
125,LU0290357929,XTRACKERS II GL INF-LINK EUR H UCITS ETF,XGIN.MI,BLOOMBERG BARCLAYS WORLD GOV INFLATION-LINKED BOND,0.0025,INFLAZIONE,XTRACKERS,ETF,XGIN.MI
126,LU0290358224,XTRACKERS II EUROZ INFL-LINK UCITS ETF,XEIN.MI,BLOOMBERG BARCLAYS EURO GOV INFLATION-LINKED BOND,0.002,INFLAZIONE,XTRACKERS,ETF,XEIN.MI
127,LU0290358497,XTRACKERS II EUR CASH SWAP UCITS ETF,XEON.MI,EONIA TR INDEX,0.0005,LIQUIDITA',XTRACKERS,ETF,XEON.MI
128,LU0290359032,XTRAC II ITR CROSSOV DAY SWAP UCITS ETF,XTXC.MI,ITRAXX CROSSOVER 5-YEAR TR INDEX,0.0024,INDICI DI CREDITO,XTRACKERS,ETF,XTXC.MI
129,LU0292095535,XTRACKERS EUSTX QUALITY DIVID UCITS ETF,XD3E.MI,EURO STOXX QUALITY DIVIDEND 50,0.003,AZIONARIO STYLE (SVILUPPATI),XTRACKERS,ETF,XD3E.MI
130,LU0292096186,XTRACK STX GL SEL DIV 100 SWAP UCITS ETF,XGSD.MI,STOXX GLOBAL SELECT DIVIDEND 100,0.005,AZIONARIO STYLE (SVILUPPATI),XTRACKERS,ETF,XGSD.MI
131,LU0292100046,XTRACKERS MSCI KOREA UCITS ETF,XMKO.MI,MSCI KOREA TRN,0.0065,AZIONARIO EMERGENTI - ASIA,XTRACKERS,ETF,XMKO.MI
132,LU0292100806,XTRACK STX EU 600 BAS RES SWAP UCITS ETF,XSPR.MI,STOXX EUROPE 600 BASIC RESOURCES TR,0.003,AZIONARIO SETTORIALI (SVILUPPATI),XTRACKERS,ETF,XSPR.MI
133,LU0292101796,XTRACK STX EU 600 OIL&GAS SWAP UCITS ETF,XSER.MI,STOXX EUROPE 600 OIL & GAS TR,0.003,AZIONARIO SETTORIALI (SVILUPPATI),XTRACKERS,ETF,XSER.MI
134,LU0292103222,XTRAC STX EU600 HEAL CARE SWAP UCITS ETF,XSDR.MI,STOXX 600 HEALTH CARE TR,0.003,AZIONARIO SETTORIALI (SVILUPPATI),XTRACKERS,ETF,XSDR.MI
135,LU0292103651,XTRACKERS STX EU600 BANKS SWAP UCITS ETF,XS7R.MI,STOXX 600 BANKS TR,0.003,AZIONARIO SETTORIALI (SVILUPPATI),XTRACKERS,ETF,XS7R.MI
136,LU0292104030,XTRACK STX EU600 TELECOM SWAP UCITS ETF,XSKR.MI,STOXX 600 TELECOMMUNICATIONS TR,0.003,AZIONARIO SETTORIALI (SVILUPPATI),XTRACKERS,ETF,XSKR.MI
137,LU0292104469,XTRACKERS STX EU 600 TECH SWAP UCITS ETF,XS8R.MI,STOXX 600 TECHNOLOGY TR,0.003,AZIONARIO SETTORIALI (SVILUPPATI),XTRACKERS,ETF,XS8R.MI
138,LU0292104899,XTRACK STX EU600 UTILIT SWAP UCITS ETF,XS6R.MI,STOXX EUROPE 600 UTILITIES TR,0.003,AZIONARIO SETTORIALI (SVILUPPATI),XTRACKERS,ETF,XS6R.MI
139,LU0292105359,XTRAC STX EU 600 FOOD&BEV SWAP UCITS ETF,XS3R.MI,STOXX 600 FOOD AND BEVERAGE TR,0.003,AZIONARIO SETTORIALI (SVILUPPATI),XTRACKERS,ETF,XS3R.MI
140,LU0292106084,XTRAC STX EU600 IND GOODS SWAP UCITS ETF,XSNR.MI,STOXX 600 INDUSTRIAL GOODS & SERVICES TR,0.003,AZIONARIO SETTORIALI (SVILUPPATI),XTRACKERS,ETF,XSNR.MI
141,LU0292106167,XTRACK DBLCI COMM OPT YLD SWAP UCITS ETF,XDBC.MI,FX HEDGED DB LIQUID COMM IND OPTIMUM Y BALANCED,0.0055,COMMODITIES,XTRACKERS,ETF,XDBC.MI
142,LU0292107645,XTRACKERS MSCI EMERG MKTS SWAP UCITS ETF,XMEM.MI,MSCI EMERGING MARKETS TRN INDEX,0.0065,AZIONARIO EMERGENTI - MONDO,XTRACKERS,ETF,XMEM.MI
143,LU0292107991,XTRACKERS MSCI EM ASIA SWAP UCITS ETF,XMAS.MI,MSCI EM ASIA TRN INDEX,0.0065,AZIONARIO EMERGENTI - ASIA,XTRACKERS,ETF,XMAS.MI
144,LU0292108619,XTRACKERS MSCI EM LATAM SWAP UCITS ETF,XMLA.MI,MSCI EM LATIN AMERICA USD NET RETURN,0.0065,AZIONARIO EMERGENTI - CENTRO/SUD AMERICA,XTRACKERS,ETF,XMLA.MI
145,LU0292109005,XTRACKERS MSCI EM EMEA SWAP UCITS ETF,XMEA.MI,MSCI EM EMEA TRN INDEX,0.0065,AZIONARIO EMERGENTI - MONDO,XTRACKERS,ETF,XMEA.MI
146,LU0292109187,XTRACKERS MSCI TAIWAN UCITS ETF,XMTW.MI,MSCI TAIWAN TRN INDEX,0.0065,AZIONARIO EMERGENTI - ASIA,XTRACKERS,ETF,XMTW.MI
147,LU0292109344,XTRACKERS MSCI BRAZIL UCITS ETF,XMBR.MI,MSCI BRAZIL TRN INDEX,0.0065,AZIONARIO EMERGENTI - CENTRO/SUD AMERICA,XTRACKERS,ETF,XMBR.MI
148,LU0292109690,XTRACKERS NIFTY 50 SWAP UCITS ETF,XNIF.MI,NIFTY 50,0.0085,AZIONARIO EMERGENTI - ASIA,XTRACKERS,ETF,XNIF.MI
149,LU0292109856,XTRACKERS FTSE CHINA 50 UCITS ETF,XX25.MI,FTSE CHINA 50 TR,0.006,AZIONARIO EMERGENTI - ASIA,XTRACKERS,ETF,XX25.MI
150,LU0321462870,XTRAC II ITR CROSS SH DAY SWAP UCITS ETF,XTC5.MI,ITRAXX CROSSOVER 5-YEAR SHORT TR,0.0024,INDICI DI CREDITO,XTRACKERS,ETF,XTC5.MI
151,LU0321462953,XTRACKERS II EM BOND EUR H C UCITS ETF,XEMB.MI,FTSE EMER MARKETS USD GOV AND GOV-REL BOND SEL NTR,0.004,TITOLI DI STATO - EMERGENTI,XTRACKERS,ETF,XEMB.MI
152,LU0321464652,XTRACKERS II GBP CASH SWAP UCITS ETF,XSTR.MI,SONIA TOTAL RETURN INDEX,0.0015,LIQUIDITA',XTRACKERS,ETF,XSTR.MI
153,LU0321465469,XTRACKERS II USD CASH SWAP UCITS ETF,XFFE.MI,FED FUNDS EFFECTIVE RATE TR,0.0015,LIQUIDITA',XTRACKERS,ETF,XFFE.MI
154,LU0322250712,XTRACKERS LPX PRIVATE EQ SWAP UCITS ETF,XLPE.MI,LPX MAJOR MARKET TR,0.007,AZIONARIO TEMATICI,XTRACKERS,ETF,XLPE.MI
155,LU0322250985,XTRACKERS CAC 40 UCITS ETF,XCAC.MI,CAC 40,0.002,AZIONARIO EUROPA - SINGOLI PAESI,XTRACKERS,ETF,XCAC.MI
156,LU0322252171,XTRACK MSCI AC ASIA EXJPN SWAP UCITS ETF,XAXJ.MI,MSCI AC ASIA EX JAPAN TRN INDEX,0.0065,AZIONARIO EMERGENTI - ASIA,XTRACKERS,ETF,XAXJ.MI
157,LU0322252338,XTRACKERS MSCI PACIFIC EXJAPAN UCITS ETF,XPXJ.MI,MSCI PACIFIC EX JAPAN TRN INDEX,0.0045,AZIONARIO PACIFICO,XTRACKERS,ETF,XPXJ.MI
158,LU0322252502,XTRACKERS MSCI RUSSIA CAP SWAP UCITS ETF,XMRC.MI,MSCI RUSSIA CAPPED,0.0065,AZIONARIO EMERGENTI - EST EUROPA,XTRACKERS,ETF,XMRC.MI
159,LU0322252924,XTRACKERS FTSE VIETNAM SWAP UCITS ETF,XFVT.MI,FTSE VIETNAM TR,0.0085,AZIONARIO EMERGENTI - ASIA,XTRACKERS,ETF,XFVT.MI
160,LU0322253229,XTRACKERS S&P GLOB INFRAS SWAP UCITS ETF,XSGI.MI,S&P GLOBAL INFRASTRUCTURE TR,0.006,AZIONARIO TEMATICI,XTRACKERS,ETF,XSGI.MI
161,LU0322253906,XTRACKERS MSCI EU SMALLCAP UCITS ETF DR,XXSC.MI,MSCI EUROPE SMALL CAP NTR,0.004,AZIONARIO STYLE (SVILUPPATI),XTRACKERS,ETF,XXSC.MI
162,LU0328474803,XTRACKERS S&P ASX 200 UCITS ETF,XAUS.MI,S&P/ASX 200 TR,0.005,AZIONARIO PACIFICO,XTRACKERS,ETF,XAUS.MI
163,LU0328475792,XTRACKERS STOXX EUROPE 600 UCITS ETF,XSX6.MI,STOXX 600 TR,0.002,AZIONARIO EUROPA - AREA,XTRACKERS,ETF,XSX6.MI
164,LU0328476410,XTRACKERS S&P SEL FRONT SWAP UCITS ETF,XSFR.MI,S&P SELECT FRONTIER NTR,0.0095,AZIONARIO EMERGENTI - MONDO,XTRACKERS,ETF,XSFR.MI
165,LU0378818131,XTRACKERS II GL GOVT EUR HED C UCITS ETF,XGSH.MI,FTSE WORLD GOV BOND HEDGED,0.0025,TITOLI DI STATO - MONDO,XTRACKERS,ETF,XGSH.MI
166,LU0380865021,XTRACKERS EURO STOXX 50 UCITS ETF 1C,XESC.MI,EURO STOXX 50 TRN,0.0009,AZIONARIO EUROPA - AREA,XTRACKERS,ETF,XESC.MI
167,IE00B3DKXQ41,ISHARES EU AGGREGATE BOND UCITS ETF DIST,IEAG.MI,BARCLAYS EURO AGGREGATE BOND TR,0.0025,OBBLIGAZIONARIO MISTO,ISHARES,ETF,IEAG.MI
168,IE00B3F81R35,ISHARES CORE EU CORP BOND UCITS ETF DIST,IEAC.MI,BARCLAYS EURO CORPORATE BOND TR,0.002,OBBLIGAZIONARIO CORPORATE - EURO,ISHARES,ETF,IEAC.MI
169,IE00B3FH7618,ISHARES EU GOVT BOND 0-1Y UCITS ETF DIST,IEGE.MI,BARCLAYS EURO SHORT TREASURY (0-12MONTH)TR,0.002,TITOLI DI STATO - EURO,ISHARES,ETF,IEGE.MI
170,IE00B3VWMM18,ISHARES MSCI EMU SMALL CAP UCITS ETF ACC,CSEMUS.MI,MSCI EMU SMALL CAP TRN,0.0058,AZIONARIO STYLE (SVILUPPATI),ISHARES,ETF,CSEMUS.MI
171,IE00B3VWM098,ISHARES MSCI USA SMALL CAP UCITS ETF ACC,CSUSS.MI,MSCI USA SMALL CAP TRN,0.0043,AZIONARIO STYLE (SVILUPPATI),ISHARES,ETF,CSUSS.MI
172,IE00B3VTMJ91,ISHARES EU GOVT BOND 1-3YR UCITS ETF ACC,CSBGE3.MI,BARCLAYS EURO GOV BOND 1-3 YEAR TERM,0.002,TITOLI DI STATO - EURO,ISHARES,ETF,CSBGE3.MI
173,IE00B3VTML14,ISHARES EU GOVT BOND 3-7YR UCITS ETF ACC,CSBGE7.MI,BARCLAYS EURO GOV BOND 3-7 YEAR TERM,0.002,TITOLI DI STATO - EURO,ISHARES,ETF,CSBGE7.MI
174,IE00B3VWN179,ISHARES $ TREA 1-3YR UCITS ETF USD ACC B,CSBGU3.MI,BARCLAYS US TREASURY 1-3 YEAR TERM,0.002,TITOLI DI STATO - NON EURO,ISHARES,ETF,CSBGU3.MI
175,IE00B3VWN393,ISHARES $ TREASURY 3-7YR UCITS ETF ACC,CSBGU7.MI,BARCLAYS US TREASURY 3-7 YEAR TERM,0.002,TITOLI DI STATO - NON EURO,ISHARES,ETF,CSBGU7.MI
176,IE00B4L5YC18,ISHARES MSCI EM UCITS ETF USD ACC,SEMA.MI,MSCI EMERGING MARKETS TRN INDEX,0.0075,AZIONARIO EMERGENTI - MONDO,ISHARES,ETF,SEMA.MI
177,IE00B4K48X80,ISHARESCOREMSCIEUROPE€(ACC) UCITS ETF,SMEA.MI,MSCI TRN EUROPE INDEX,0.0012,AZIONARIO EUROPA - AREA,ISHARES,ETF,SMEA.MI
178,IE00B4L5YX21,ISHARES CORE MSCI JAP IMI UCITS ETF ACC,SJPA.MI,MSCI JAPAN INVESTABLE MARKET TRN (IMI),0.002,AZIONARIO PACIFICO,ISHARES,ETF,SJPA.MI
179,IE00B4L5Y983,ISHARES CORE MSCI WORLD UCITS ETF ACC,SWDA.MI,MSCI TRN WORLD INDEX,0.002,AZIONARIO MONDO,ISHARES,ETF,SWDA.MI
180,IE00B4WXJD03,ISHARES MSCI PACIFIC EX-J UCITS ETF DIST,SPXJ.MI,MSCI PACIFIC EX JAPAN TRN INDEX,0.006,AZIONARIO PACIFICO,ISHARES,ETF,SPXJ.MI
