,isin,nome,ticker,benchmark,ter,areaBenchmark,emittente,strumento,dataSource
546,LU1459800113,UBS BL BA US 10+Y TR UCITS ETF EU H A-DI,UST10F.MI,BLOOMBERG BARCLAYS CAPITALUS10+YTREABONDHEDGEEURTR,0.0025,TITOLI DI STATO - NON EURO,UBS ETF,ETF,LU1459800113
547,IE00BDF12W49,WISDOMTREE EMER MKT EQ INC UCITS ETF ACC,DEMR.MI,WISDOMTREE EMERGING MARKETS HIGH DIVIDEND INDEX,0.0046,AZIONARIO EMERGENTI - MONDO,WISDOMTREE,ETF,IE00BDF12W49
548,IE00BDF16007,WISDOMTREE EUROPE EQ INCOM UCITS ETF ACC,EEIA.MI,WISDOMTREE EUROPE EQUITY INCOME INDEX,0.0029,AZIONARIO EUROPA - AREA,WISDOMTREE,ETF,IE00BDF16007
549,IE00BDF16114,WISDOMTREE EU SMALLCAP DIV UCITS ETF ACC,DFEA.MI,WISDOMTREE EUROPE SMALLCAP DIVIDEND INDEX,0.0038,AZIONARIO STYLE (SVILUPPATI),WISDOMTREE,ETF,IE00BDF16114
550,IE00BD6RZT93,WISDOMTREE US EQUITY INCOM UCITS ETF ACC,DHSA.MI,WISDOMTREE US EQUITY INCOME INDEX,0.0029,AZIONARIO NORD AMERICA,WISDOMTREE,ETF,IE00BD6RZT93
551,IE00BD6RZW23,WISDOMTREE US EQ IN UCITS ETF EU HED ACC,DHSF.MI,WISDOMTREE US EUR HEDGED EQUITY INCOME INDEX,0.0035,AZIONARIO NORD AMERICA,WISDOMTREE,ETF,IE00BD6RZW23
552,FR0013209921,LYXOR MSCI WORLD EX EMU UCITS ETF - ACC,WLDX.MI,MSCI WORLD EX EMU NTR,0.0035,AZIONARIO MONDO,LYXOR,ETF,FR0013209921
553,LU1435356495,LYXOR BOFAML $ HI YLD EU H UCITS ETF DIS,USYH.MI,BOFA MERRILL L US HIGH Y CONST EUR HED INDEX,0.004,OBBLIGAZIONARIO CORPORATE - HIGH YIELD,LYXOR,ETF,LU1435356495
554,LU1459801780,UBS BL BAR TIPS 1-10 UCITS ETF EUR HED,TIP1E.MI,BLOOMBERG BARCLAYSCAPITALUSGOV1-10YINFLLINKBONDEUH,0.002,INFLAZIONE,UBS ETF,ETF,LU1459801780
555,LU1435770406,LYXOR COMM CRB EX-AGRIC UCITS ETF ACC,CRBA.MI,THOM REUT/CORE COMM CRB NON-AGRI AND LIVESTOCK TRI,0.0035,COMMODITIES,LYXOR,ETF,LU1435770406
556,LU1437024992,AMUNDI MSCI BRAZIL UCITS ETF,BRZ.MI,MSCI BRAZIL INDEX,0.0055,AZIONARIO EMERGENTI - CENTRO/SUD AMERICA,AMUNDI,ETF,LU1437024992
557,IE00BS7K8821,SPDR BL BAR 3-5Y EURO GOVT UCITS ETF,EU35.MI,BARCLAYS 3-5 YEAR EURO TREASURY BOND INDEX,0.0015,TITOLI DI STATO - EURO,SPDR,ETF,IE00BS7K8821
558,IE00BYSZ5R67,SPDR BARCL 3-5 Y US TREASURY UCITS ETF,TRS5.MI,BARCLAYS CAPITAL US 3-5 YEAR TREASURY BOND TR,0.0015,TITOLI DI STATO - NON EURO,SPDR,ETF,IE00BYSZ5R67
559,IE00BYSZ5S74,SPDR BARCL 5-7 Y US TREASURY UCITS ETF,TRS7.MI,BARCLAYS CAPITAL US 5-7 YEAR TREASURY BOND TR,0.0015,TITOLI DI STATO - NON EURO,SPDR,ETF,IE00BYSZ5S74
560,IE00BYSZ5T81,SPDR BARCL 7-10 Y US TREASURY UCITS ETF,TRSX.MI,BLOOMBERG BARCLAYS US 7-10 YEAR TREASURY BOND TR,0.0015,TITOLI DI STATO - NON EURO,SPDR,ETF,IE00BYSZ5T81
561,IE00BYSZ5V04,SPDR BARCL 10+ Y US TREASURY UCITS ETF,LUTR.MI,BARCLAYS CAPITAL US 10+ YEAR TREASURY BOND TR,0.0015,TITOLI DI STATO - NON EURO,SPDR,ETF,IE00BYSZ5V04
562,IE00BYSZ5W11,SPDR BARCL 3-7 Y EU CORPORATE UCITS ETF,EC37.MI,BARCLAYS EURO 3-7 YEAR CORPORATE BOND INDEX,0.002,OBBLIGAZIONARIO CORPORATE - EURO,SPDR,ETF,IE00BYSZ5W11
563,IE00BYSZ5Y35,SPDR BARCL 5-7 Y EURO GOVT UCITS ETF,EU57.MI,BARCLAYS EURO 5-7 YEAR TREASURY BOND INDEX,0.0015,TITOLI DI STATO - EURO,SPDR,ETF,IE00BYSZ5Y35
564,IE00BYSZ5Z42,SPDR BARCL 7-10 Y EURO GOVT UCITS ETF,EU7L.MI,BARCLAYS EURO 7-10 YEAR TREASURY BOND INDEX,0.0015,TITOLI DI STATO - EURO,SPDR,ETF,IE00BYSZ5Z42
565,IE00BYSZ6062,SPDR BARCL 10+ Y EURO GOVT UCITS ETF,LGOV.MI,BARCLAYS EURO 10+ YEAR TREASURY BOND INDEX,0.0015,TITOLI DI STATO - EURO,SPDR,ETF,IE00BYSZ6062
566,IE00BYV12Y75,SPDR BL BAR 3-10Y US COR BOND UCITS ETF,IUCB.MI,BARCLAYS U.S. 3-10 YEAR CORPORATE BOND INDEX,0.002,OBBLIGAZIONARIO CORPORATE - NON EURO,SPDR,ETF,IE00BYV12Y75
567,IE00B3VY0M37,SPDR BARCL US CORPORATE BOND UCITS ETF,USCO.MI,BARCLAYS U.S. CORPORATE BOND INDEX,0.002,OBBLIGAZIONARIO CORPORATE - NON EURO,SPDR,ETF,IE00B3VY0M37
568,IE00BZ0G8860,SPDR BL BAR 10+Y US CORP BOND UCITS ETF,LUSC.MI,BARCLAYS U.S. LONG CORPORATE INDEX,0.002,OBBLIGAZIONARIO CORPORATE - NON EURO,SPDR,ETF,IE00BZ0G8860
569,LU1390062831,LYXOR US$ 10Y INFL EXPECT UCITS ETF ACC,INFU.MI,MARKIT IBOXX USD BREAKEVEN 10Y INF IND NOMINAL TRI,0.0025,INFLAZIONE,LYXOR,ETF,LU1390062831
570,LU1452600270,LYXOR CORE US TIPS DR UCITS ETF DIST,TIPU.MI,BARCLAYS U.S. GOV INFLATION-LINKED ALL BONDS TR,0.0009,INFLAZIONE,LYXOR,ETF,LU1452600270
571,LU1435356149,LYXOR BOFAML $ HIGH YIELD UCITS ETF DIST,USHY.MI,BOFA MERRILL L US HIGH YIELD CONSTRAINED,0.003,OBBLIGAZIONARIO CORPORATE - HIGH YIELD,LYXOR,ETF,LU1435356149
573,LU1237527673,LYXOR FTSE EMER MIN VAR UCITS ETF ACC,MVAM.MI,FTSE EMERGING MINIMUM VARIANCE NET TAX INDEX,0.004,AZIONARIO EMERGENTI - MONDO,LYXOR,ETF,LU1237527673
574,LU1389266302,LYXOR FTSE ALL WLD MIN VAR UCITS ETF ACC,MVAW.MI,FTSE ALL WORLD MINIMUM VARIANCE NET TAX INDEX,0.003,AZIONARIO MONDO,LYXOR,ETF,LU1389266302
575,LU1484799769,UBS BL BA MSCI EU LIQ CORP SUS UCITS ETF,CBSEU.MI,BLOOMBERG BARCLAYS MSCI EURO AREA LIQ CORP SUST TR,0.002,OBBLIGAZIONARIO CORPORATE - EURO,UBS ETF,ETF,LU1484799769
576,LU1130155606,UBS MSCI CANADA UCITS ETF EUR HEDGED ACC,CAHEUA.MI,MSCI CANADA 100% HEDGED TO EUR TRN,0.0043,AZIONARIO NORD AMERICA,UBS ETF,ETF,LU1130155606
577,IE00BYM11K57,UBS MSCI ACWI SF UCITS ETF EUR HEDG ACC,ACWIE.MI,MSCI ACWI 100% HEDGED EUR TRN,0.0022,AZIONARIO MONDO,UBS ETF,ETF,IE00BYM11K57
578,IE00BDGSNL04,WISDOMTREE INDIA QUALITY UCITS ETF ACC,EPIE.MI,WISDOMTREE INDIA QUALITY INDEX,0.0073,AZIONARIO STYLE (EMERGENTI),WISDOMTREE,ETF,IE00BDGSNL04
579,IE00BDB7J586,XTRACKERS MSCI USA MINIM VOL UCITS ETF,XMVU.MI,MSCI USA MINIMUM VOLATILITY TRN,0.002,AZIONARIO NORD AMERICA,XTRACKERS,ETF,IE00BDB7J586
580,IE00BDGN9Z19,XTRACKERS MSCI EMU MINIM VOL UCITS ETF,XMVE.MI,MSCI EMU MINIMUM VOLATILITY TRN,0.0025,AZIONARIO EUROPA - AREA,XTRACKERS,ETF,IE00BDGN9Z19
581,LU1399300455,XTRACKERS II US TREAS EURO HED UCITS ETF,XUTE.MI,IBOXX $ TREASURIES TR,0.002,TITOLI DI STATO - NON EURO,XTRACKERS,ETF,LU1399300455
582,LU1437015735,AMUNDI MSCI EUROPE UCITS ETF DR,CEU2.MI,MSCI EUROPE,0.0015,AZIONARIO EUROPA - AREA,AMUNDI,ETF,LU1437015735
583,LU1437016204,AMUNDI JP MORGAN GBI GL GOV UCITS ETF DR,GGOV.MI,JPMORGAN GOVERNMENT BOND INDEX GLOBAL,0.002,TITOLI DI STATO - MONDO,AMUNDI,ETF,LU1437016204
584,LU1437016543,AMUNDI MSCI NORTH AMERICA UCITS ETF DR,NRAM.MI,MSCI NORTH AMERICA,0.0015,AZIONARIO NORD AMERICA,AMUNDI,ETF,LU1437016543
585,LU1437016972,AMUNDI MSCI WORLD UCITS ETF DR,MWRD.MI,MSCI WORLD INDEX,0.0018,AZIONARIO MONDO,AMUNDI,ETF,LU1437016972
586,LU1437017863,AMUNDI S&P 500 UCITS ETF DR,S500.MI,S&P 500,0.0015,AZIONARIO NORD AMERICA,AMUNDI,ETF,LU1437017863
587,LU1437018168,AMUNDI INDEX EUR AGG CORP SRI UCITS ETF,ECRP.MI,BLOOMBERG BARCLAYS MSCI EURO CORPORATE SRI,0.0016,OBBLIGAZIONARIO CORPORATE - EURO,AMUNDI,ETF,LU1437018168
588,LU1437018598,AMUNDI JP MORGAN EMU GOV IG UCITS ETF DR,EGOV.MI,JP MORGAN EMU GBI INVESTMENT GRADE,0.0014,TITOLI DI STATO - EURO,AMUNDI,ETF,LU1437018598
589,LU1437018838,AMUNDI FTSE EPRA NAREIT GLO UCITS ETF DR,EPRA.MI,FTSE EPRA/NAREIT DEV EU NTR,0.0024,REAL ESTATE,AMUNDI,ETF,LU1437018838
590,LU1437024729,AMUNDI BARCL GLOB AGG 500M UCITS ETF DR,GAGG.MI,BARCLAYS GLOBAL AGGREGATE 500 MILLION,0.002,OBBLIGAZIONARIO MISTO,AMUNDI,ETF,LU1437024729
591,LU1525418643,AMUNDI BAR EU CORP BBB 1-5 UCITS ETF DR,EBBB.MI,BARCLAYS EURO CORPORATE BBB 1-5 YEAR,0.002,OBBLIGAZIONARIO CORPORATE - EURO,AMUNDI,ETF,LU1525418643
592,LU1525418726,AMUNDI BAR US CORP BBB 1-5 UCITS ETF DR,UBBB.MI,BARCLAYS US CORPORATE BBB 1-5 YEAR,0.002,OBBLIGAZIONARIO CORPORATE - NON EURO,AMUNDI,ETF,LU1525418726
593,LU1525419294,AMUNDI BAR US GOV INFL-LINK UCITS ETF DR,ATIP.MI,BARCLAYS CAPITAL US GOVERN INFLATION-LINKED BOND,0.0016,INFLAZIONE,AMUNDI,ETF,LU1525419294
594,LU1407887329,LYXOR $ TREAS 1-3Y DR EU H UCITS ETF DIS,U13H.MI,MARKIT IBOXX USD TREAS 1-3MIDPRICE TCA(EUR HEDGED),0.0015,TITOLI DI STATO - NON EURO,LYXOR,ETF,LU1407887329
595,IE00BD6FTQ80,INVESCO BLOOMBERG COMMODITY UCITS ETF,CMOD.MI,BLOOMBERG COMMODITY INDEX,0.0019,COMMODITIES,INVESCO,ETF,IE00BD6FTQ80
596,IE00BYXZ2585,ISHARESCOREMSCIEMU(DIST) UCITS ETF,CEUD.MI,MSCI EMU TRN,0.0012,AZIONARIO EUROPA - AREA,ISHARES,ETF,IE00BYXZ2585
597,IE00BD6GCF16,FIRST TRUST US EQUITY INCOME UCITS ETF B,UNCA.MI,NASDAQ US HIGH EQUITY INCOME NET TOTAL RETURN,0.0055,AZIONARIO NORD AMERICA,FIRST TRUST,ETF,IE00BD6GCF16
598,IE00BQQP9F84,VANECK VECTORS GOLD MINERS UCITS ETF,GDX.MI,NYSE ARCA GOLD MINERS INDEX,0.0053,AZIONARIO TEMATICI,VANECK,ETF,IE00BQQP9F84
599,IE00BQQP9G91,VANECK JUNIOR GOLD MINERS UCITS ETF,GDXJ.MI,MVIS GLOBAL JUNIOR GOLD MINERS INDEX,0.0055,AZIONARIO TEMATICI,VANECK,ETF,IE00BQQP9G91
600,IE00BQQP9H09,VANECK MORNINGST US WIDE MOAT UCITS ETF,MOAT.MI,MORNINGSTAR WIDE MOAT FOCUS INDEX,0.0049,AZIONARIO STYLE (SVILUPPATI),VANECK,ETF,IE00BQQP9H09
601,IE00BDS67326,VANECK J.P. MORGAN EM LOC CURR UCITS ETF,EMLC.MI,J.P. MORGAN GBI-EMG CORE INDEX,0.003,TITOLI DI STATO - EMERGENTI,VANECK,ETF,IE00BDS67326
602,LU1605710802,LYXOR ITALIA EQUITY PIR DR UCITS ETF,ITAPIR.MI,FTSE ITALIA PIR LARGE AND MID CAP NET TAX,0.0035,AZIONARIO ITALIA,LYXOR,ETF,LU1605710802
604,IE00B5SSQT16,HSBC MSCI EMERGING MARKETS UCITS ETF,HMEM.MI,MSCI EMERGING MARKETS TRN INDEX,0.004,AZIONARIO EMERGENTI - MONDO,HSBC,ETF,IE00B5SSQT16
605,IE00B5VX7566,HSBC MSCI JAPAN UCITS ETF,HMJD.MI,MSCI TRN JAPAN INDEX,0.0019,AZIONARIO PACIFICO,HSBC,ETF,IE00B5VX7566
606,IE00B5KQNG97,HSBC S&P 500 UCITS ETF,HSPD.MI,S&P 500 TRN USD,0.0009,AZIONARIO NORD AMERICA,HSBC,ETF,IE00B5KQNG97
607,IE00B4X9L533,HSBC MSCI WORLD UCITS ETF,HMWD.MI,MSCI TRN WORLD INDEX,0.0015,AZIONARIO MONDO,HSBC,ETF,IE00B4X9L533
608,IE00B4K6B022,HSBC EURO STOXX 50 UCITS ETF,H50E.MI,EURO STOXX 50 TRN,0.0005,AZIONARIO EUROPA - AREA,HSBC,ETF,IE00B4K6B022
609,LU1377381717,BNPP EASY LOWVOL EUROPE UCITS ETF,EVOE.MI,BNP PARIBAS EQUITY LOW VOL EUROPE TR INDEX,0.003,AZIONARIO STYLE (SVILUPPATI),BNP PARIBAS,ETF,LU1377381717
610,LU1377381980,BNPP EASY LOWVOL US UCITS ETF,EVOU.MI,BNP PARIBAS EQUITY LOW VOL US TR INDEX,0.003,AZIONARIO STYLE (SVILUPPATI),BNP PARIBAS,ETF,LU1377381980
611,LU1377382012,BNPP EASY MOMENTUM EUROPE UCITS ETF,EMOM.MI,BNP PARIBAS EQUITY MOMENTUM EUROPE TR,0.003,AZIONARIO STYLE (SVILUPPATI),BNP PARIBAS,ETF,LU1377382012
612,LU1377382103,BNPP EASY QUALITY EUROPE UCITS ETF,EQUA.MI,BNP PARIBAS EQUITY QUALITY EUROPE TR,0.003,AZIONARIO STYLE (SVILUPPATI),BNP PARIBAS,ETF,LU1377382103
613,LU1377382285,BNPP EASY VALUE EUROPE UCITS ETF,EVAE.MI,BNP PARIBAS EQUITY VALUE EUROPE TR,0.003,AZIONARIO STYLE (SVILUPPATI),BNP PARIBAS,ETF,LU1377382285
614,LU0950381748,BNPP EASY FTSE EPRA EUROZONE UCITS ETF,EEA.MI,FTSE EPRA/NAREIT EUROZONE CAPPED (NTR) INDEX,0.005,REAL ESTATE,BNP PARIBAS,ETF,LU0950381748
615,LU1291097779,BNPP EASY MSCI EM EXCW UCITS ETF,EEMK.MI,MSCI EMERGING MARKETS EX CONTROVERSIAL WEAPONS NTR,0.0035,AZIONARIO TEMATICI,BNP PARIBAS,ETF,LU1291097779
616,LU1291098827,BNPP EASY MSCI EMU EXCW UCITS ETF,EEMU.MI,MSCI EMU EX CONTROVERSIAL WEAPONS (NTR) INDEX,0.0025,AZIONARIO TEMATICI,BNP PARIBAS,ETF,LU1291098827
617,LU1291099718,BNPP EASY MSCI EUROPE EXCW UCITS ETF,EEUE.MI,MSCI EUROPE EX CONTROVERSIAL WEAPONS (NTR) INDEX,0.0025,AZIONARIO TEMATICI,BNP PARIBAS,ETF,LU1291099718
618,LU1481203070,BNPP EASY MSCI JAP EXCW H EUR UCITS ETF,EJAH.MI,MSCI JAPAN EX CONTROVERSIAL WEAPONS (NTR) INDEX,0.0025,AZIONARIO TEMATICI,BNP PARIBAS,ETF,LU1481203070
619,LU1291104575,BNPP EASY MSCI N AMERICA EXCW UCITS ETF,ENAM.MI,MSCI NORTH AMERICA EX CONTROVERSIAL WEAPONS (NTR),0.0025,AZIONARIO TEMATICI,BNP PARIBAS,ETF,LU1291104575
620,LU1291106356,BNPP EASY MSCI PACIF EXJP EXCW UCITS ETF,EPEJ.MI,MSCI PACIFIC EX-JAPAN EX CONTROVERSIAL WEAPONS NTR,0.0025,AZIONARIO TEMATICI,BNP PARIBAS,ETF,LU1291106356
621,LU1291109293,BNPP EASY NMX 30 INFRA GLOBAL UCITS ETF,EENG.MI,NMX 30 INFRASTRUCTURE GLOBAL (TR) INDEX,0.007,AZIONARIO TEMATICI,BNP PARIBAS,ETF,LU1291109293
622,IE00BDGV0308,UBS (IRL) MSCI USA SEL FAC MIX UCITS ETF,USFMD.MI,MSCI USA SELECT FACTOR MIX TRN,0.003,AZIONARIO STYLE (SVILUPPATI),UBS ETF,ETF,IE00BDGV0308
623,LU1600334798,UBS ETF MSCI EUROPE EUR HEDGED UCITS ETF,EUEUA.MI,MSCI EUROPE 100% HEDGED TO EUR TRN,0.003,AZIONARIO EUROPA - AREA,UBS ETF,ETF,LU1600334798
624,LU1617164998,LYXOR BOFAML EU SH TER HY UCITS ETF DIST,HYS.MI,BOFA MERRILL L BB-CCC 1-3 Y EU DEV MKT HI YLD CONS,0.003,OBBLIGAZIONARIO CORPORATE - HIGH YIELD,LYXOR,ETF,LU1617164998
625,LU1617164212,LYXOR BOFAML $ SH TE HY EH UCITS ETF DIS,HYSTH.MI,BOFA MERRILL L BB-CCC 1-3 Y US HIGH Y CONS EU HED,0.004,OBBLIGAZIONARIO CORPORATE - HIGH YIELD,LYXOR,ETF,LU1617164212
626,LU1571052130,LYXOR $ FLOA RAT NOTE EU H UCITS ETF DIS,FLOTH.MI,BLOOMBERG BARCLAYS US CORP FRN 2-7 YR TR HED EUR,0.0015,OBBLIGAZIONARIO CORPORATE - NON EURO,LYXOR,ETF,LU1571052130
627,LU1589326013,UBS BARC US LIQ CORP INT R HDG UCITS ETF,CBUSIH.MI,BLOOMBERG BARCLAYSUSLIQUIDCORPORATESDURATIONHEDGTR,0.0023,OBBLIGAZIONARIO CORPORATE - NON EURO,UBS ETF,ETF,LU1589326013
628,LU1589350070,AMUNDI US EQ MUL SM SC BETA UCITS ETF DR,SMTU.MI,SCIENTIFIC BETA US MULTI-BETA-STRATEGY 4-FACTORERC,0.0033,AZIONARIO NORD AMERICA,AMUNDI,ETF,LU1589350070
629,FR0013267846,AMUNDI ETF FTSE ITALIA PIR UCITS ETF DR,ITALI.MI,FTSE ITALIA PIR NTR,0.0035,AZIONARIO ITALIA,AMUNDI,ETF,FR0013267846
630,IE00BF5LJ058,ISHARES FTSE ITAL MIDSMALL CAP UCITS ETF,IPIR.MI,FTSE ITALIA PIR MID SMALL CAP,0.0033,AZIONARIO ITALIA,ISHARES,ETF,IE00BF5LJ058
632,LU1598690169,LYXOR MSCI EMU VALUE DR UCITS ETF DIST,VAL.MI,MSCI EMU VALUE TRN,0.004,AZIONARIO STYLE (SVILUPPATI),LYXOR,ETF,LU1598690169
633,LU1598689153,LYXOR MSCI EMU SMALL CAP DR UCITS ETF,MMS.MI,MSCI EMU SMALL CAP TRN,0.004,AZIONARIO STYLE (SVILUPPATI),LYXOR,ETF,MMS.MI
634,LU1598688189,LYXOR MSCI EMU GROWTH DR UCITS ETF DIST,GWT.MI,MSCI EMU GROWTH TRN,0.004,AZIONARIO STYLE (SVILUPPATI),LYXOR,ETF,GWT.MI
635,LU1598691217,LYXOR EMTS 10Y ITA BTP DR UCITS ETF ACC,BTP10.MI,FTSE MTS TARGET MATURITY GOV BOND ITALY MIDP,0.00165,TITOLI DI STATO - ITALIA,LYXOR,ETF,LU1598691217
637,LU1390062245,LYXOR EUR 2-10Y INFLAT EXP UCITS ETF ACC,INFL.MI,MARKIT IBOXX EUR BREAKEVEN EURO-INFLAT FRA&GER NTR,0.0025,INFLAZIONE,LYXOR,ETF,LU1390062245
638,IE00BTJRMP35,XTRACKERS MSCI EMERG MARKETS UCITS ETF,XMME.MI,MSCI EMERGING MARKETS TRN INDEX,0.002,AZIONARIO EMERGENTI - MONDO,XTRACKERS,ETF,IE00BTJRMP35
639,IE00BD4DXB77,XTR USD EM BOND QU WEIG EU HED UCITS ETF,XQUE.MI,MARKIT IBOXX USD EMERG MARKETS SOV QUA WEI EUR HED,0.0055,TITOLI DI STATO - EMERGENTI,XTRACKERS,ETF,IE00BD4DXB77
640,LU0429459356,XTRACKERS II US TREASURIES UCITS ETF,XUTD.MI,IBOXX $ TREASURIES TR,0.0015,TITOLI DI STATO - NON EURO,XTRACKERS,ETF,LU0429459356
641,LU0962078753,XTRACK II GL INF-LINK EUR H D UCITS ETF,XGII.MI,BLOOMBERG BARCLAYS WORLD GOV INFL-LIN BOND EUR HED,0.0025,INFLAZIONE,XTRACKERS,ETF,LU0962078753
642,IE00BF11F458,ISHARES $ FLOAT RATE UCITS ETF EUR HED,FLOE.MI,BLOOMBERG BARCLAYS US FLOATING RATE NOTE < 5YEARS,0.0012,OBBLIGAZIONARIO CORPORATE - NON EURO,ISHARES,ETF,IE00BF11F458
643,IE00BZ048462,ISHARES $ FLOATING RATE UCITS ETF USD,FLTR.MI,BLOOMBERG BARCLAYS US FLOATING RATE NOTE < 5YEARS,0.001,OBBLIGAZIONARIO CORPORATE - NON EURO,ISHARES,ETF,IE00BZ048462
644,IE00BDVJF675,INVESCO PREFERRED SHARES UCITS ETF,PRFD.MI,BOFA MERRILL L DIV CORE PL FX PREF SEC NTR,0.005,AZIONARIO NORD AMERICA,INVESCO,ETF,IE00BDVJF675
645,IE00B60SWZ49,INVESCO STOXX EUROPE SMALL 200 UCITS ETF,SDJSML.MI,STOXX EUROPE SMALL 200 NTR,0.0035,AZIONARIO EUROPA - AREA,INVESCO,ETF,IE00B60SWZ49
646,LU1646362167,LYXOR FTSE USA MINIM VAR UCITS ETF ACC,MVAU.MI,FTSE USA MINIMUM VARIANCE NET INDEX,0.002,AZIONARIO NORD AMERICA,LYXOR,ETF,LU1646362167
647,LU1650492173,LYXOR FTSE 100 UCITS ETF - ACC,FTS100.MI,FTSE 100 TR,0.0015,AZIONARIO EUROPA - SINGOLI PAESI,LYXOR,ETF,LU1650492173
648,IE00BYML9W36,INVESCO S&P 500 UCITS ETF - B,SPXD.MI,S&P 500 TRN USD,0.0005,AZIONARIO NORD AMERICA,INVESCO,ETF,IE00BYML9W36
649,IE00B5B5TG76,INVESCO EURO STOXX 50 UCITS ETF (B),SDJE5D.MI,EURO STOXX 50,0.0005,AZIONARIO EUROPA - AREA,INVESCO,ETF,IE00B5B5TG76
650,IE00BD8D5H32,PIMCO EU SH-TERM HIGH YLD CORP UCITS ETF,EUHI.MI,BOFA MERRILL L 0-5 YEAR US HIGH YIELD 2% CONSTRAIN,0.0044,OBBLIGAZIONARIO CORPORATE - HIGH YIELD,INVESCO,ETF,IE00BD8D5H32
651,LU1645380368,UBS BLOOM BAR EU INF LINK 1-10 UCITS ETF,INFL1.MI,BLOOMBERG BARCLAYS EURO GOV INFLATION-LINK 1-10 Y,0.002,INFLAZIONE,UBS ETF,ETF,LU1645380368
652,LU1645381689,UBS BLOOM BAR EU INFL LINK 10+ UCITS ETF,INFL10.MI,BLOOMBERG BARCLAYS EURO GOV INFLATION-LINK 10+ Y,0.002,INFLAZIONE,UBS ETF,ETF,LU1645381689
653,LU1645385839,UBS J.P. MORGAN US EM DIV 1-5 UCITS ETF,SHEMB.MI,JP MORGAN USD EM DIVERSIFIED 3% CAPPED 1-5 Y BOND,0.0042,TITOLI DI STATO - EMERGENTI,UBS ETF,ETF,LU1645385839
654,LU1650487413,LYXOR EMTS 1-3Y INV GR DR UCITS ETF ACC,EM13.MI,FTSE MTS EUROZONE GOV BOND IG 1-3 Y MIDP,0.00165,TITOLI DI STATO - EURO,LYXOR,ETF,EM13.MI
655,LU1650488494,LYXOR EMTS 3-5Y INV GR DR UCITS ETF ACC,EM35.MI,FTSE MTS EUROZONE GOV BOND IG 3-5 Y MIDP,0.00165,TITOLI DI STATO - EURO,LYXOR,ETF,EM35.MI
656,LU1650489385,LYXOR EMTS 10-15Y IG DR UCITS ETF ACC,EM1015.MI,FTSE MTS EUROZONE GOV BOND IG 10-15 Y MIDP,0.00165,TITOLI DI STATO - EURO,LYXOR,ETF,EM1015.MI
657,LU1650490474,LYXOR EMTS ALL-MAT IN G DR UCITS ETF ACC,EMG.MI,FTSE MTS EUROZONE GOV BOND IG MIDP,0.00165,TITOLI DI STATO - EURO,LYXOR,ETF,EMG.MI
658,LU1650491282,LYXOR EMTS INFL LINK IG DR UCITS ETF ACC,EMI.MI,FTSE MTS EUZONE INFLATION-LINKED BOND IG MIDP,0.002,INFLAZIONE,LYXOR,ETF,EMI.MI
659,IE00B60SX063,INVESCO STOXX EUROPE MID 200 UCITS ETF,SDJMID.MI,STOXX EUROPE MID 200 INDEX,0.0035,AZIONARIO EUROPA - AREA,INVESCO,ETF,SDJMID.MI
660,LU1646360971,LYXOR CORE MSCI EMU DR UCITS ETF DIST,EMU.MI,MSCI EMU TRN,0.0012,AZIONARIO EUROPA - AREA,LYXOR,ETF,EMU.MI
663,IE00BDR55927,UBS MSCI ACWI SOC RESP EUR HED UCITS ETF,AWSRIE.MI,MSCI ACWI SRI 5% ISSUER CAPPED 100% HEDGE EUR NR,0.0048,AZIONARIO TEMATICI,UBS ETF,ETF,AWSRIE.MI
667,FR0013284304,AMUNDI ISTX EU MUL-FAC MKT NEU UCITS ETF,MKTN.MI,ISTOXX EUROPE MULTI-FACTOR MARKET NEUTRAL,0.0055,AZIONARIO STYLE (SVILUPPATI),AMUNDI,ETF,MKTN.MI
668,LU1681048630,AMUNDI S&P GLOBAL LUXURY UCITS ETF,GLUX.MI,S&P GLOBAL LUXURY,0.0025,AZIONARIO TEMATICI,AMUNDI,ETF,GLUX.MI
669,LU1681046006,AMUNDI MSCI WORLD ENERGY UCITS ETF,CWE.MI,MSCI WORLD ENERGY NTR,0.0035,AZIONARIO SETTORIALI (SVILUPPATI),AMUNDI,ETF,CWE.MI
670,LU1681045883,AMUNDI MSCI WORLD FINANCIALS UCITS ETF,CWF.MI,MSCI WORLD FINANCIALS NTR,0.0035,AZIONARIO SETTORIALI (SVILUPPATI),AMUNDI,ETF,CWF.MI
672,LU1681037518,AMUNDI FTSE MIB UCITS ETF,FMI.MI,FTSE MIB,0.0018,AZIONARIO ITALIA,AMUNDI,ETF,FMI.MI
674,IE00BF51JZ00,INVESCO ITA PIR MUL-ASS PORT UCITS ETF,PIRI.MI,ITLMSN ITSCAN ITSTARN CFIIITCS DRBGN CFIIHYFA,0.0045,MULTI ASSET,INVESCO,ETF,PIRI.MI
676,IE00BF2B0M76,FRANKLIN LIBERTYQ GLOBAL DIVID UCITS ETF,FLXX.MI,LIBERTYQ GLOBAL DIVIDEND INDEX,0.0045,AZIONARIO STYLE (SVILUPPATI),FRANKLIN TEMPLETON,ETF,FLXX.MI
677,IE00BF2B0N83,FRANKLIN LIBERTYQ GLOB EQ SRI UCITS ETF,FLXG.MI,LIBERTYQ GLOBAL EQUITY SRI INDEX,0.004,AZIONARIO STYLE (SVILUPPATI),FRANKLIN TEMPLETON,ETF,FLXG.MI
678,IE00BF2B0L69,FRANKLIN LIBERTYQ EUROP DIVID UCITS ETF,FLXD.MI,LIBERTYQ EUROPEAN DIVIDEND INDEX,0.0025,AZIONARIO STYLE (SVILUPPATI),FRANKLIN TEMPLETON,ETF,FLXD.MI
679,IE00BF2B0K52,FRANKLIN LIBERTYQ EMERGING MKT UCITS ETF,FLXE.MI,LIBERTYQ EMERGING MARKETS NR INDEX,0.0055,AZIONARIO STYLE (EMERGENTI),FRANKLIN TEMPLETON,ETF,FLXE.MI
681,LU1681047236,AMUNDI EURO STOXX 50 UCITS ETF DR - EUR,C50.MI,EURO STOXX 50,0.0015,AZIONARIO EUROPA - AREA,AMUNDI,ETF,C50.MI
682,LU1602144575,AMUNDI MSCI EMU UCITS ETF DR - EUR,CMU.MI,MSCI EMU TRN,0.0025,AZIONARIO EUROPA - AREA,AMUNDI,ETF,CMU.MI
683,LU1602144732,AMUNDI MSCI JAPAN UCITS ETF DR - EUR,CJ1.MI,MSCI JAPAN,0.0045,AZIONARIO PACIFICO,AMUNDI,ETF,CJ1.MI
684,LU1602144906,AMUNDI MSCI PACIF EXJPN UCITS ETF DR EUR,CP9.MI,MSCI PACIFIC EX JAPAN,0.0045,AZIONARIO PACIFICO,AMUNDI,ETF,CP9.MI
689,IE00BDFC6G93,JPMORGAN USD EM MKT SOVER BOND UCITS ETF,JPMB.MI,J.P. MORGAN EMERGING MARKETS RISK-AWARE BOND INDEX,0.0039,TITOLI DI STATO - EMERGENTI,JP MORGAN,ETF,JPMB.MI
690,IE00BYVZV757,JPM BETABUIL EUR GOV 1-3 Y ACC UCITS ETF,JE13.MI,JPMORGAN EMU GOV BOND INDEX 1-3 TR,0.001,TITOLI DI STATO - EURO,JP MORGAN,ETF,JE13.MI
691,IE00BF0M2Z96,L&G BATTERY VALUE-CHAIN UCITS ETF,BATT.MI,SOLACTIVE BATTERY VALUE-CHAIN INDEX,0.0075,AZIONARIO TEMATICI,LEGAL & GENERAL,ETF,BATT.MI
692,IE00BF0H7608,L&G PHARMA BREAKTHROUGH UCITS ETF,BIOT.MI,SOLACTIVE PHARMA BREAKTHROUGH VALUE INDEX NTR,0.0075,AZIONARIO TEMATICI,LEGAL & GENERAL,ETF,BIOT.MI
693,IE00BF0M6N54,L&G ECOMMERCE LOGISTICS UCITS ETF,ECOM.MI,SOLACTIVE ECOMMERCE LOGISTICS INDEX,0.0075,AZIONARIO TEMATICI,LEGAL & GENERAL,ETF,ECOM.MI
697,LU1681041205,AMUNDI GL EM BOND MARK IBX UCITS ETF USD,AGEB.MI,MARKIT IBOXX $ LIQUID EMERGING MARKETS SOVEREIGNS,0.003,TITOLI DI STATO - EMERGENTI,AMUNDI,ETF,AGEB.MI
700,LU1681046691,AMUNDI GOV HIG RAT EMTS IG UCITS ETF EUR,AM3A.MI,FTSE MTS HIGHEST-RATED EUROZONE GOV BOND,0.0014,TITOLI DI STATO - EURO,AMUNDI,ETF,AM3A.MI
704,IE00BDR5H073,UBS GLOB GEN EQUAL UCITS ETF EUR HED ACC,GENDEE.MI,SOLACTIVE EQUI GLO GEN EQ 100 LEAD NTR EUR CU HED,0.003,AZIONARIO TEMATICI,UBS ETF,ETF,GENDEE.MI
705,LU1681048804,AMUNDI S&P 500 EUR UCITS ETF,A500.MI,S&P 500 TRN USD,0.0015,AZIONARIO NORD AMERICA,AMUNDI,ETF,A500.MI
708,LU1681044647,AMUNDI MSCI NORDIC EUR UCITS ETF,CN1.MI,MSCI NORDIC COUNTRIES TRN,0.0025,AZIONARIO EUROPA - AREA,AMUNDI,ETF,CN1.MI
709,LU1681042609,AMUNDI MSCI EUROPE UCITS ETF - EUR,CEU.MI,MSCI TRN EUROPE INDEX,0.0015,AZIONARIO EUROPA - AREA,AMUNDI,ETF,CEU.MI
717,LU1781541179,LYXOR CORE MSCI WORLD DR UCITS ETF,LCWD.MI,MSCI TRN WORLD INDEX,0.0012,AZIONARIO MONDO,LYXOR,ETF,LCWD.MI
718,LU1781541252,LYXOR CORE MSCI JAPAN DR UCITS ETF,LCJP.MI,MSCI TRN JAPAN INDEX,0.0012,AZIONARIO PACIFICO,LYXOR,ETF,LCJP.MI
719,LU1781541849,LYXOR MSCI EM ASIA UCITS ETF,LCAS.MI,MSCI EM ASIA TRN INDEX,0.0012,AZIONARIO EMERGENTI - ASIA,LYXOR,ETF,LCAS.MI
720,LU1781541096,LYXOR CORE MORNING UK NT DR UCITS ETF,LCUK.MI,MORNINGSTAR UK NR INDEX,0.0004,AZIONARIO EUROPA - SINGOLI PAESI,LYXOR,ETF,LCUK.MI
721,LU1781540957,LYXOR CORE MORNINGSTAR US DR UCITS ETF,LCUS.MI,MORNINGSTAR US LARGE-MID CAP NR INDEX,0.0004,AZIONARIO NORD AMERICA,LYXOR,ETF,LCUS.MI
722,LU1681039647,AMUNDI EURO CORPORATES EUR UCITS ETF,CC4.MI,MARKIT IBOXX EUR LIQ CORP TOP 75 MID TCA,0.0016,OBBLIGAZIONARIO CORPORATE - EURO,AMUNDI,ETF,CC4.MI
727,LU1681046261,AMUNDI GOV EMTS BROAD IG UCITS ETF,CB3.MI,FTSE MTS EUROZONE GOV BROAD IG,0.0014,TITOLI DI STATO - EURO,AMUNDI,ETF,CB3.MI
729,LU1681046774,AMUNDI GOV LOW RAT EMTS IG EUR UCITS ETF,X1G.MI,FTSE MTS LOWEST-RATED EUROZONE GOV BOND IG,0.0014,TITOLI DI STATO - EURO,AMUNDI,ETF,X1G.MI
730,LU1681042864,AMUNDI MSCI USA UCITS ETF - EUR,CU2.MI,MSCI USA,0.0028,AZIONARIO NORD AMERICA,AMUNDI,ETF,CU2.MI
731,LU1681043086,AMUNDI MSCI INDIA UCITS ETF - EUR,CI2.MI,MSCI INDIA,0.008,AZIONARIO EMERGENTI - ASIA,AMUNDI,ETF,CI2.MI
732,LU1681043912,AMUNDI MSCI CHINA UCITS ETF - EUR,CC1.MI,MSCI CHINA H TRN,0.0055,AZIONARIO EMERGENTI - ASIA,AMUNDI,ETF,CC1.MI
733,LU1681043599,AMUNDI MSCI WORLD UCITS ETF - EUR,CW8.MI,MSCI WORLD INDEX,0.0038,AZIONARIO MONDO,AMUNDI,ETF,CW8.MI
734,LU1681038243,AMUNDI NASDAQ-100 UCITS ETF - EUR,ANX.MI,NASDAQ 100,0.0023,AZIONARIO NORD AMERICA,AMUNDI,ETF,ANX.MI
736,LU1681045370,AMUNDI MSCI EMERGING UCITS ETF - EUR,AEEM.MI,MSCI EMERGING MARKETS INDEX,0.002,AZIONARIO EMERGENTI - MONDO,AMUNDI,ETF,AEEM.MI
740,IE00BDR5HM97,XTRACKERS USD HY CORPORAT BOND UCITS ETF,XUHY.MI,BLOOMBERG BARCLAYS US HIGH YIELD VERY LIQ EX 144A,0.0035,OBBLIGAZIONARIO CORPORATE - HIGH YIELD,XTRACKERS,ETF,XUHY.MI
741,LU0514695690,XTRACKERS MSCI CHINA UCITS ETF,XCS6.MI,MSCI CHINA TR NET DAILY USD,0.0065,AZIONARIO EMERGENTI - ASIA,XTRACKERS,ETF,XCS6.MI
742,IE00BF8J5974,XTRACK IBOXX USD CORP YIELD PL UCITS ETF,XYLD.MI,MARKIT IBOXX USD CORPORATES 1-20 YIELD PLUS,0.0025,OBBLIGAZIONARIO CORPORATE - HIGH YIELD,XTRACKERS,ETF,XYLD.MI
743,LU0950668870,UBS MSCI EMU UCITS ETF (EUR) A-ACC,EMUAA.MI,MSCI EMU INDEX NR,0.0018,AZIONARIO EUROPA - AREA,UBS ETF,ETF,EMUAA.MI
744,IE00BDGV0746,UBS MSCI US SEL FAC MIX UCITS ETF EU HED,USMUFE.MI,MSCI USA SELECT FACTOR MIX 100% HEDGED TO EUR NR,0.004,AZIONARIO STYLE (SVILUPPATI),UBS ETF,ETF,USMUFE.MI
745,IE00BWT3KS11,UBS MSCI AUSTRALIA UCITS ETF EUR HED ACC,AUHEUA.MI,MSCI AUSTRALIA 100% HEDGED TO EUR TRN,0.005,AZIONARIO PACIFICO,UBS ETF,ETF,AUHEUA.MI
746,IE00BDT8V027,INVESCO PREF SHARES UCITS ETF EU H DIS,PRFE.MI,BOFA MERRILL L DIV CORE PL FX PREF SEC NTR,0.0055,AZIONARIO NORD AMERICA,INVESCO,ETF,PRFE.MI
752,IE00BF5DXP42,FIRST TRUST INDXX INN TRA&PROC UCITS ETF,BLOK.MI,INDXX BLOCKCHAIN NTR,0.0065,AZIONARIO TEMATICI,FIRST TRUST,ETF,BLOK.MI
753,LU1810006863,LYXOR SCIENT BETA DEVELOP L/S UCITS ETF,MFLS.MI,SGI GLOBAL MULTI FACTOR MARKET NEUTRAL INDEX,0.0055,AZIONARIO STYLE (SVILUPPATI),LYXOR,ETF,MFLS.MI
754,IE00BDFBTK17,VANECK NATURAL RESOURCES UCITS ETF,HAP.MI,VANECKA NATURAL RESOURCES INDEX,0.005,AZIONARIO TEMATICI,VANECK,ETF,HAP.MI
755,IE00BDFBTR85,VANECK PREFERRED US EQUITY UCITS ETF,PREF.MI,WELLS FARGO HYBRID AND PREFERRED SECURITIES AGGREG,0.0041,AZIONARIO TEMATICI,VANECK,ETF,PREF.MI
756,IE00BF541080,VANECK EMER MKTS HIGH YLD BOND UCITS ETF,HYEM.MI,ICE BOFAML DIV HIGH YIELD US EMERGING MARK CORP PL,0.004,OBBLIGAZIONARIO CORPORATE - EMERGENTI,VANECK,ETF,HYEM.MI
757,IE00BF540Z61,VANECK GL FALLEN ANGEL HI YLD UCITS ETF,GFA.MI,ICE BOFAML GLOBAL FALLEN ANGEL HIGH YIELD INDEX,0.004,OBBLIGAZIONARIO CORPORATE - HIGH YIELD,VANECK,ETF,GFA.MI
758,IE00BDFBTQ78,VANECK GLOBAL MINING UCITS ETF,GDIG.MI,EMIX GLOBAL MINING CONSTRAINED WEIGHTS INDEX,0.005,AZIONARIO TEMATICI,VANECK,ETF,GDIG.MI
760,IE00BZ0XVF52,WISDOMTREE AT1 COCO BOND UCITS ETF - USD,CCBO.MI,IBOXX CONTINGEN CONVER LIQ DEVEL EUR AT1 USD UNHGD,0.005,OBBLIGAZIONARIO CORPORATE - EURO,WISDOMTREE,ETF,CCBO.MI
761,IE00BD9MMD49,JPM BETABUIL TREAS 1-3 USD ACC UCITS ETF,JU13.MI,JPMORGAN GOV BOND INDEX UNITED STATES 1-3 Y,0.001,TITOLI DI STATO - NON EURO,JP MORGAN,ETF,JU13.MI
764,LU0484968812,XTRACKERS II ESG EUR CORP B UCITS ETF,XB4F.MI,BLOOMBERG BARCLAYS MSCI EURO CORP SUSTAIN AND SRI,0.0025,OBBLIGAZIONARIO CORPORATE - EURO,XTRACKERS,ETF,XB4F.MI
765,LU0677077884,XTRACKERS II USD EMRG MKTS B UCITS ETF,XUEM.MI,FTSE EMERGING MARKETS GOV AND GOV-RELATED SEL BOND,0.0035,TITOLI DI STATO - EMERGENTI,XTRACKERS,ETF,XUEM.MI
